{"id":"era3-tls-visibility","era":3,"experiment":"HTTP plaintext versus HTTPS visibility","protocols":["TLS","HTTPS","TCP"],"environment":"Linux network namespace with temporary self-signed certificate","topology":"client and TLS origin on isolated loopback address","capture_point":"pz-era3-http:lo","capture_filter":"tcp port 18443","tool":"OpenSSL curl Python tcpdump tshark","tool_version":"OpenSSL 3.0.13 30 Jan 2024 (Library: OpenSSL 3.0.13 30 Jan 2024)","started_at":"2026-08-29T15:36:31Z","bounded":true,"result":"pass","evidence_level":"L3","files":["captures/era3-tls/https.pcapng","captures/era3-tls/https.frames.tsv","captures/era3-tls/https-body.txt","captures/era3-tls/server.log"],"claims":["Capture exposes IP, TCP and TLS handshake metadata while the HTTP payload is not readable as plaintext HTTP."],"limitations":["Self-signed local TLS does not establish public PKI trust and no real private session content was used."],"cleanup_verified":true,"wan":{"used":false,"endpoint_role":"none","provider_specific_claim":false}}
