{"id":"era3-http-versions","era":3,"experiment":"HTTP/1.0 and HTTP/1.1 plaintext connection evidence","protocols":["HTTP/1.0","HTTP/1.1","TCP"],"environment":"Linux network namespace and Python mature stdlib server","topology":"client and origin on isolated loopback address","capture_point":"pz-era3-http:lo","capture_filter":"tcp port 18080","tool":"curl Python tcpdump tshark","tool_version":"curl 8.5.0 (x86_64-pc-linux-gnu) libcurl/8.5.0 OpenSSL/3.0.13 zlib/1.3 brotli/1.1.0 zstd/1.5.5 libidn2/2.3.7 libpsl/0.21.2 (+libidn2/2.3.7) libssh/0.10.6/openssl/zlib nghttp2/1.59.0 librtmp/2.3 OpenLDAP/2.6.7","started_at":"2026-08-29T15:36:31Z","bounded":true,"result":"pass","evidence_level":"L3","files":["captures/era3-http/http-versions.pcapng","captures/era3-http/http-versions.frames.tsv","captures/era3-http/http10-body.txt","captures/era3-http/http11-body.txt","captures/era3-http/server.log"],"claims":["Plaintext capture exposes HTTP version, Host and application payload while separate client invocations create separate TCP streams."],"limitations":["This is a local modern reconstruction, not a historical browser workload; pipelining and chunked transfer are not claimed."],"cleanup_verified":true,"wan":{"used":false,"endpoint_role":"none","provider_specific_claim":false}}
