{"id":"era3-dns-hierarchy","era":3,"experiment":"miniature delegated DNS hierarchy and recursive cache","protocols":["DNS"],"environment":"Linux network namespace with four BIND instances","topology":"root -> test -> museum.test; separate recursive resolver","capture_point":"pz-era3-dns:lo","capture_filter":"port 53","tool":"BIND dig tcpdump tshark","tool_version":"BIND 9.18.39-0ubuntu0.24.04.6-Ubuntu (Extended Support Version) <id:>","started_at":"2026-08-29T15:22:50Z","bounded":true,"result":"pass","evidence_level":"L3","files":["captures/era3-dns/dns-hierarchy.pcapng","captures/era3-dns/dns-hierarchy.frames.tsv","captures/era3-dns/dig-first.txt","captures/era3-dns/dig-cache-hit.txt","captures/era3-dns/dig-after-ttl.txt","captures/era3-dns/dig-nxdomain-first.txt","captures/era3-dns/dig-nxdomain-cache.txt","captures/era3-dns/dig-delegation.txt"],"claims":["Local evidence shows delegation, glue, recursion, cache reuse, TTL expiry and NXDOMAIN negative caching."],"limitations":["Modern BIND reconstruction is not an original 1983 deployment and uses a single namespace loopback fabric."],"cleanup_verified":true,"wan":{"used":false,"endpoint_role":"none","provider_specific_claim":false}}
