{"id":"era3-traceroute-local","era":3,"experiment":"UDP and ICMP traceroute against known two-hop topology","protocols":["IPv4","ICMP","UDP","traceroute"],"environment":"three Linux network namespaces","topology":"client -> router -> server","capture_point":"pz-era3-path-r:any","capture_filter":"icmp or udp portrange 33434-33534","tool":"traceroute tcpdump tshark","tool_version":"Modern traceroute for Linux, version 2.1.5","started_at":"2026-08-29T16:11:21Z","bounded":true,"result":"pass","evidence_level":"L3","files":["captures/era3-traceroute/traceroute.pcapng","captures/era3-traceroute/traceroute.frames.tsv","captures/era3-traceroute/traceroute-udp.txt","captures/era3-traceroute/traceroute-icmp.txt"],"claims":["TTL expiry exposes the known router at hop 1 and destination at hop 2 for bounded UDP and ICMP probes."],"limitations":["Local ground-truth topology; missing public-path replies would not imply failed routers."],"cleanup_verified":true,"wan":{"used":false,"endpoint_role":"none","provider_specific_claim":false}}
