{"id":"era3-pmtud-local","era":3,"experiment":"IPv4 PMTUD over 1500-to-1400 path","protocols":["IPv4","ICMP","PMTUD"],"environment":"three Linux network namespaces","topology":"client --1500-- router --1400-- server","capture_point":"pz-era3-path-r:any","capture_filter":"icmp or UDP traceroute ports","tool":"ip ping traceroute tcpdump tshark","tool_version":"ping from iputils 20240117","started_at":"2026-08-29T16:11:21Z","bounded":true,"result":"pass","evidence_level":"L3","files":["captures/era3-pmtud/pmtud-traceroute.pcapng","captures/era3-pmtud/pmtud-traceroute.frames.tsv","captures/era3-pmtud/ping-1400.txt","captures/era3-pmtud/ping-1401.txt","captures/era3-pmtud/route-cache.txt"],"claims":["A 1400-byte IPv4 packet succeeds while a 1401-byte DF packet elicits ICMP fragmentation-needed with next-hop MTU 1400."],"limitations":["Local controlled IPv4 reconstruction; no WAN PMTU value or IPv6 PTB behavior is inferred."],"cleanup_verified":true,"wan":{"used":false,"endpoint_role":"none","provider_specific_claim":false}}
