{"id":"era3-reverse-proxy","era":3,"experiment":"private reverse proxy connection termination","protocols":["HTTP","TCP","reverse-proxy"],"environment":"Linux namespace with HAProxy and Python origin","topology":"client -> HAProxy -> origin on private loopback addresses","capture_point":"pz-era3-mb:lo","capture_filter":"tcp port 18080 or tcp port 18081","tool":"HAProxy curl tcpdump tshark ss conntrack","tool_version":"HAProxy version 2.8.16-0ubuntu0.24.04.3 2026/06/19 - https://haproxy.org/","started_at":"2026-08-29T16:08:22Z","bounded":true,"result":"pass","evidence_level":"L3","files":["captures/era3-proxy/reverse-proxy.pcapng","captures/era3-proxy/reverse-proxy.frames.tsv","captures/era3-proxy/client.txt","captures/era3-proxy/sockets.txt","captures/era3-proxy/backend.log","captures/era3-nat/conntrack.txt"],"claims":["One client request produces separate client-to-proxy and proxy-to-origin TCP legs, demonstrating transport termination rather than NAT-only forwarding."],"limitations":["Local single-namespace reconstruction; no public proxy or provider behavior is claimed."],"cleanup_verified":true,"wan":{"used":false,"endpoint_role":"none","provider_specific_claim":false}}
