{"id":"era3-gre-overlay","era":3,"experiment":"private GRE overlay outer and inner packet evidence","protocols":["GRE","IPv4","ICMP"],"environment":"Linux network namespaces","topology":"two private veth endpoints carrying GRE tunnel","capture_point":"pz-era3-tun-b:pz-era3-vb","capture_filter":"proto 47 or icmp","tool":"ip ping tcpdump tshark","tool_version":"ip utility, iproute2-6.1.0, libbpf 1.3.0","started_at":"2026-08-29T16:05:56Z","bounded":true,"result":"pass","evidence_level":"L3","files":["captures/era3-tunnels/gre-overlay.pcapng","captures/era3-tunnels/gre-overlay.frames.tsv"],"claims":["Outer IPv4 protocol 47 encapsulates inner IPv4 ICMP between separate private tunnel addresses."],"limitations":["Private Linux reconstruction; GRE provides no encryption and this is not a public tunnel or performance measurement."],"cleanup_verified":true,"wan":{"used":false,"endpoint_role":"none","provider_specific_claim":false}}
